17:34:04.018276 IP 192.168.122.1.60343 > 192.168.122.239.9801: Flags [S], seq 560438475:560438479, win 29200, options [mss 1460,sackOK,TS val 413242348 ecr 0,nop,wscale 7], length 5
17:34:04.018276 IP 192.168.122.1.60343 > 192.168.122.239.9801: Flags [S], seq 560438476:560438477, win 29200, options [mss 1460,sackOK,TS val 413242348 ecr 0,nop,wscale 7], length 15
17:34:04.018276 IP 192.168.122.1.60343 > 192.168.122.239.9801: Flags [S], seq 560438460:560438480, win 29200, options [mss 1460,sackOK,TS val 413242348 ecr 0,nop,wscale 7], length 15
